subj,run,item,list,category,sentence,joke ending,nonjoke ending,displayed,response,RT,question onset
0.0000,8.000,2,38,1,nonjoke,This fall two things are turning yellow: trees and,investors,bushes,This fall two things are turning yellow: trees and bushes.,<VisionEgg.WrappedText.WrappedText object at 0x1090e0c80>
8.0000,8.000,2,133,1,joke,He likes to make things around the house; this week it's the,maid,shelves,He likes to make things around the house; this week it's the maid.,<VisionEgg.WrappedText.WrappedText object at 0x1090e0d20>
16.0000,2.000,fix
18.0000,8.000,2,143,1,joke,Most of the people running for office are not politicians; they're,commuters,candidates,Most of the people running for office are not politicians; they're commuters.,<VisionEgg.WrappedText.WrappedText object at 0x1090e0d70>
26.0000,8.000,2,116,1,nonjoke,Autobiography is an unrivaled vehicle for telling the truth about,others,somebody,Autobiography is an unrivaled vehicle for telling the truth about somebody.,<VisionEgg.WrappedText.WrappedText object at 0x1090e0e10>
34.0000,8.000,2,153,1,joke,The husband who catches his wife in the act is probably on the,trapeze,snoop,The husband who catches his wife in the act is probably on the trapeze.,<VisionEgg.WrappedText.WrappedText object at 0x1090e0dc0>
42.0000,8.000,2,114,1,nonjoke,It's extraordinary what fine poker hand you get when you're playing,bridge,stud,It's extraordinary what fine poker hand you get when you're playing stud.,<VisionEgg.WrappedText.WrappedText object at 0x1090e0e60>
50.0000,2.000,fix
52.0000,8.000,2,40,1,nonjoke,No patient should leave the hospital until he's strong enough to face the,cashier,outside,No patient should leave the hospital until he's strong enough to face the outside.,<VisionEgg.WrappedText.WrappedText object at 0x1090e0eb0>
60.0000,2.000,fix
62.0000,8.000,2,30,1,nonjoke,Nothing you put in a banana split is as potentially fattening as the,spoon,syrup,Nothing you put in a banana split is as potentially fattening as the syrup.,<VisionEgg.WrappedText.WrappedText object at 0x1090e0f00>
70.0000,2.000,fix
72.0000,8.000,2,3,1,joke,A thoughtful wife has pork chops ready when her husband comes home from,fishing,working,A thoughtful wife has pork chops ready when her husband comes home from fishing.,<VisionEgg.WrappedText.WrappedText object at 0x1090e0fa0>
80.0000,2.000,fix
82.0000,8.000,2,134,1,nonjoke,My church welcomes all denominations but prefers,twenties,Mormons,My church welcomes all denominations but prefers Mormons.,<VisionEgg.WrappedText.WrappedText object at 0x1090e0f50>
90.0000,8.000,2,84,1,nonjoke,"The convict told his cellmate how he'd blown all the money he stole on wine, women, and ",lawyers,crack,"The convict told his cellmate how he'd blown all the money he stole on wine, women, and crack.",<VisionEgg.WrappedText.WrappedText object at 0x1106bd0f0>
98.0000,2.000,fix
100.0000,8.000,2,90,1,nonjoke,A vacation is the shortest distance between two,paychecks,locations,A vacation is the shortest distance between two locations.,<VisionEgg.WrappedText.WrappedText object at 0x1106bd050>
108.0000,8.000,2,115,1,joke,"In the game of golf, nothing counts as much as your",opponent,drives,"In the game of golf, nothing counts as much as your opponent.",<VisionEgg.WrappedText.WrappedText object at 0x1106bd0a0>
116.0000,6.000,fix
122.0000,8.000,2,124,1,nonjoke,"I've got Parkinson's disease, and he's got", mine,gout,"I've got Parkinson's disease, and he's got gout.",<VisionEgg.WrappedText.WrappedText object at 0x1106bd140>
130.0000,8.000,fix
138.0000,8.000,2,94,1,nonjoke,"To get something done, a committee should consist of no more than three people, two of whom are",dead,workers,"To get something done, a committee should consist of no more than three people, two of whom are workers.",<VisionEgg.WrappedText.WrappedText object at 0x1106bd190>
146.0000,8.000,2,151,1,joke,One good turn gets most of the,blanket,profit,One good turn gets most of the blanket.,<VisionEgg.WrappedText.WrappedText object at 0x1106bd1e0>
154.0000,8.000,2,91,1,joke,"If there's one thing that counts in business, its",bookkeepers,resources,"If there's one thing that counts in business, its bookkeepers.",<VisionEgg.WrappedText.WrappedText object at 0x1106bd280>
162.0000,6.000,fix
168.0000,8.000,2,146,1,nonjoke,"Love has its benefits, and they are usually called",alimony,memories,"Love has its benefits, and they are usually called memories.",<VisionEgg.WrappedText.WrappedText object at 0x1106bd230>
176.0000,8.000,2,17,1,joke,A committee keeps minutes and takes,hours,votes,A committee keeps minutes and takes hours.,<VisionEgg.WrappedText.WrappedText object at 0x1106bd2d0>
184.0000,8.000,2,69,1,joke,"When an irresistible force meets an immovable object, you get two very angry",women,entities,"When an irresistible force meets an immovable object, you get two very angry women.",<VisionEgg.WrappedText.WrappedText object at 0x1106bd370>
192.0000,2.000,fix
194.0000,8.000,2,136,1,nonjoke,The only fishing through the ice that some men ever do is for the ,olive,trout,The only fishing through the ice that some men ever do is for the trout.,<VisionEgg.WrappedText.WrappedText object at 0x1106bd320>
202.0000,8.000,2,55,1,joke,His wife sued for divorce and asked for custody of the,cash,cat,His wife sued for divorce and asked for custody of the cash.,<VisionEgg.WrappedText.WrappedText object at 0x1106bd3c0>
210.0000,4.000,fix
214.0000,8.000,2,18,1,nonjoke,"When we watch a sexy movie, my wife leans over and breathes on my",glasses,collar,"When we watch a sexy movie, my wife leans over and breathes on my collar.",<VisionEgg.WrappedText.WrappedText object at 0x1106bd410>
222.0000,8.000,2,147,1,joke,"When we got divorced, my wife and I split the house; she got the",inside,kitchen,"When we got divorced, my wife and I split the house; she got the inside.",<VisionEgg.WrappedText.WrappedText object at 0x1106bd460>
230.0000,4.000,fix
234.0000,8.000,2,103,1,joke,"I still miss my ex-wife, but I am improving my",aim,ego,"I still miss my ex-wife, but I am improving my aim.",<VisionEgg.WrappedText.WrappedText object at 0x1106bd4b0>
242.0000,2.000,fix
244.0000,8.000,2,96,1,nonjoke,"When the kid came into the store and asked for empty boxes, the owner gave him the",register,crate,"When the kid came into the store and asked for empty boxes, the owner gave him the crate.",<VisionEgg.WrappedText.WrappedText object at 0x1106bd500>
252.0000,6.000,fix
258.0000,8.000,2,144,1,nonjoke,The difference between a dog and fox is about five,beers,degrees,The difference between a dog and fox is about five degrees.,<VisionEgg.WrappedText.WrappedText object at 0x1106bd550>
266.0000,2.000,fix
268.0000,8.000,2,20,1,nonjoke,"He told me he just bought a set of balloon tires, and I told him I didn't even know he owned a",balloon,truck,"He told me he just bought a set of balloon tires, and I told him I didn't even know he owned a truck.",<VisionEgg.WrappedText.WrappedText object at 0x1106bd5a0>
276.0000,8.000,2,86,1,nonjoke,"I asked the florist what I should give to my girlfriend, and he suggested his",address,tulips,"I asked the florist what I should give to my girlfriend, and he suggested his tulips.",<VisionEgg.WrappedText.WrappedText object at 0x1106bd5f0>
284.0000,22.000,fix
306.0000,8.000,2,78,1,nonjoke,My brother-in-law enjoys fixing things around the house so much he spent an hour last night just fixing our,drinks,stove,My brother-in-law enjoys fixing things around the house so much he spent an hour last night just fixing our stove.,<VisionEgg.WrappedText.WrappedText object at 0x1106bd690>
314.0000,8.000,2,44,1,nonjoke,The only place where you can find people who spend all their time minding their own business is the ,cemetery,bank,The only place where you can find people who spend all their time minding their own business is the bank.,<VisionEgg.WrappedText.WrappedText object at 0x1106bd640>
322.0000,8.000,2,39,1,joke,The best way to remove coffee stains from a white blouse is with,scissors,detergent,The best way to remove coffee stains from a white blouse is with scissors.,<VisionEgg.WrappedText.WrappedText object at 0x1106bd6e0>
330.0000,2.000,fix
332.0000,8.000,2,110,1,nonjoke,It's not hard to meet expenses; they're ,everywhere,affordable,It's not hard to meet expenses; they're affordable.,<VisionEgg.WrappedText.WrappedText object at 0x1106bd780>
340.0000,10.000,fix
350.0000,8.000,2,88,1,nonjoke,The wind was so strong it blew out three,fuses,streetlights,The wind was so strong it blew out three streetlights.,<VisionEgg.WrappedText.WrappedText object at 0x1106bd730>
358.0000,6.000,fix
364.0000,8.000,2,35,1,joke,"Now that the Hollywood couple has ironed out the divorce settlement, they can finally go ahead with their",nuptials,careers,"Now that the Hollywood couple has ironed out the divorce settlement, they can finally go ahead with their nuptials.",<VisionEgg.WrappedText.WrappedText object at 0x1106bd7d0>
372.0000,8.000,2,150,1,nonjoke,One way to keep pornography away from teenagers is to put it in a,textbook,cabinet,One way to keep pornography away from teenagers is to put it in a cabinet.,<VisionEgg.WrappedText.WrappedText object at 0x1106bd820>
380.0000,6.000,fix
386.0000,8.000,2,122,1,nonjoke,"If you're filthy rich, sending your kids to college is a wonderful", cleaner,luxury,"If you're filthy rich, sending your kids to college is a wonderful luxury.",<VisionEgg.WrappedText.WrappedText object at 0x1106bd870>
394.0000,4.000,fix
398.0000,8.000,2,15,1,joke,"When John bought a bulldog, it was no time at all before he had that dog eating out of his",leg,fingers,"When John bought a bulldog, it was no time at all before he had that dog eating out of his leg.",<VisionEgg.WrappedText.WrappedText object at 0x1106bd910>
406.0000,4.000,fix
410.0000,8.000,2,50,1,nonjoke,The only time my father ever raised a hand to his children was in ,self- defense,discipline,The only time my father ever raised a hand to his children was in discipline.,<VisionEgg.WrappedText.WrappedText object at 0x1106bd8c0>
418.0000,4.000,fix
422.0000,8.000,2,61,1,joke,"For great vacation, put the kids in the back seat, and take a ",cruise,freeway,"For great vacation, put the kids in the back seat, and take a cruise.",<VisionEgg.WrappedText.WrappedText object at 0x1106bd9b0>
430.0000,4.000,fix
434.0000,8.000,2,14,1,nonjoke,He got a medal for bravery on the beach when he rescued a girl from a ,lifeguard,shipwreck,He got a medal for bravery on the beach when he rescued a girl from a shipwreck.,<VisionEgg.WrappedText.WrappedText object at 0x1106bd960>
442.0000,8.000,2,149,1,joke,"She asked what state he was born in, and he said in the ",nude,East,"She asked what state he was born in, and he said in the nude.",<VisionEgg.WrappedText.WrappedText object at 0x1106bda50>
450.0000,8.000,2,129,1,joke,The perfect companion to a vegetarian dinner is a ,steak,salad,The perfect companion to a vegetarian dinner is a steak.,<VisionEgg.WrappedText.WrappedText object at 0x1106bda00>
458.0000,2.000,fix
460.0000,8.000,2,139,1,joke,They redecorated the bar with new,drunks,wood,They redecorated the bar with new drunks.,<VisionEgg.WrappedText.WrappedText object at 0x1106bdaa0>
468.0000,8.000,2,140,1,nonjoke,You can keep your kids in hot water with ,dishes,rules,You can keep your kids in hot water with rules.,<VisionEgg.WrappedText.WrappedText object at 0x1106bdb40>
476.0000,2.000,fix
478.0000,8.000,2,27,1,joke,"Once a week they hold a bingo game, and all the proceeds go to fight",gambling,disease,"Once a week they hold a bingo game, and all the proceeds go to fight gambling.",<VisionEgg.WrappedText.WrappedText object at 0x1106bdaf0>
486.0000,22.000,fix
508.0000,8.000,2,107,1,joke,The difference between a good speaker and a bad one is often a nice,nap,diction,The difference between a good speaker and a bad one is often a nice nap.,<VisionEgg.WrappedText.WrappedText object at 0x1106bdbe0>
516.0000,8.000,2,127,1,joke,The penalty for dishonesty is the disgrace of dying,rich,unloved,The penalty for dishonesty is the disgrace of dying rich.,<VisionEgg.WrappedText.WrappedText object at 0x1106bdb90>
524.0000,2.000,fix
526.0000,8.000,2,145,1,joke,The only person who sticks closer to you in adversity than a friend is a,creditor,spouse,The only person who sticks closer to you in adversity than a friend is a creditor.,<VisionEgg.WrappedText.WrappedText object at 0x1106bdc30>
534.0000,8.000,2,37,1,joke,"The cops claimed that the prisoner just decided to come clean, but most people think he was forced into the",bathtub,admission,"The cops claimed that the prisoner just decided to come clean, but most people think he was forced into the bathtub.",<VisionEgg.WrappedText.WrappedText object at 0x1106bdcd0>
542.0000,2.000,fix
544.0000,8.000,2,73,1,joke,One thing that makes the world go round is,detours,greed,One thing that makes the world go round is detours.,<VisionEgg.WrappedText.WrappedText object at 0x1106bdc80>
552.0000,10.000,fix
562.0000,8.000,2,111,1,joke,"Some husbands are good providers, but only if you count",children,salary,"Some husbands are good providers, but only if you count children.",<VisionEgg.WrappedText.WrappedText object at 0x1106bdd70>
FED_20161227a_3T2,2,38,1,nonjoke,This fall two things are turning yellow: trees and,investors,bushes,This fall two things are turning yellow: trees and bushes.,1,1.2001500129699707,6.009423017501831
FED_20161227a_3T2,2,133,1,joke,He likes to make things around the house; this week it's the,maid,shelves,He likes to make things around the house; this week it's the maid.,,,14.010308027267456
FED_20161227a_3T2,2,143,1,joke,Most of the people running for office are not politicians; they're,commuters,candidates,Most of the people running for office are not politicians; they're commuters.,2,2.0837109088897705,24.01165509223938
FED_20161227a_3T2,2,116,1,nonjoke,Autobiography is an unrivaled vehicle for telling the truth about,others,somebody,Autobiography is an unrivaled vehicle for telling the truth about somebody.,4,1.7835807800292969,32.01257514953613
FED_20161227a_3T2,2,153,1,joke,The husband who catches his wife in the act is probably on the,trapeze,snoop,The husband who catches his wife in the act is probably on the trapeze.,,,40.01350998878479
FED_20161227a_3T2,2,114,1,nonjoke,It's extraordinary what fine poker hand you get when you're playing,bridge,stud,It's extraordinary what fine poker hand you get when you're playing stud.,2,1.2168519496917725,48.014467000961304
FED_20161227a_3T2,2,40,1,nonjoke,No patient should leave the hospital until he's strong enough to face the,cashier,outside,No patient should leave the hospital until he's strong enough to face the outside.,3,1.7001900672912598,58.015748023986816
FED_20161227a_3T2,2,30,1,nonjoke,Nothing you put in a banana split is as potentially fattening as the,spoon,syrup,Nothing you put in a banana split is as potentially fattening as the syrup.,1,1.3501830101013184,68.0002760887146
FED_20161227a_3T2,2,3,1,joke,A thoughtful wife has pork chops ready when her husband comes home from,fishing,working,A thoughtful wife has pork chops ready when her husband comes home from fishing.,3,1.500204086303711,78.00147795677185
FED_20161227a_3T2,2,134,1,nonjoke,My church welcomes all denominations but prefers,twenties,Mormons,My church welcomes all denominations but prefers Mormons.,3,1.6668939590454102,88.002690076828
FED_20161227a_3T2,2,84,1,nonjoke,"The convict told his cellmate how he'd blown all the money he stole on wine, women, and ",lawyers,crack,"The convict told his cellmate how he'd blown all the money he stole on wine, women, and crack.",2,2.0002408027648926,96.0036461353302
FED_20161227a_3T2,2,90,1,nonjoke,A vacation is the shortest distance between two,paychecks,locations,A vacation is the shortest distance between two locations.,1,1.9335639476776123,106.00487804412842
FED_20161227a_3T2,2,115,1,joke,"In the game of golf, nothing counts as much as your",opponent,drives,"In the game of golf, nothing counts as much as your opponent.",3,1.2667698860168457,114.00587511062622
FED_20161227a_3T2,2,124,1,nonjoke,"I've got Parkinson's disease, and he's got", mine,gout,"I've got Parkinson's disease, and he's got gout.",1,1.2834429740905762,128.0075089931488
FED_20161227a_3T2,2,94,1,nonjoke,"To get something done, a committee should consist of no more than three people, two of whom are",dead,workers,"To get something done, a committee should consist of no more than three people, two of whom are workers.",4,1.350188970565796,144.0094029903412
FED_20161227a_3T2,2,151,1,joke,One good turn gets most of the,blanket,profit,One good turn gets most of the blanket.,,,152.0103359222412
FED_20161227a_3T2,2,91,1,joke,"If there's one thing that counts in business, its",bookkeepers,resources,"If there's one thing that counts in business, its bookkeepers.",2,1.2668170928955078,160.01131796836853
FED_20161227a_3T2,2,146,1,nonjoke,"Love has its benefits, and they are usually called",alimony,memories,"Love has its benefits, and they are usually called memories.",,,174.01303005218506
FED_20161227a_3T2,2,17,1,joke,A committee keeps minutes and takes,hours,votes,A committee keeps minutes and takes hours.,2,2.816986083984375,182.0140130519867
FED_20161227a_3T2,2,69,1,joke,"When an irresistible force meets an immovable object, you get two very angry",women,entities,"When an irresistible force meets an immovable object, you get two very angry women.",3,1.6501750946044922,190.0149209499359
FED_20161227a_3T2,2,136,1,nonjoke,The only fishing through the ice that some men ever do is for the ,olive,trout,The only fishing through the ice that some men ever do is for the trout.,1,1.4001779556274414,200.0161030292511
FED_20161227a_3T2,2,55,1,joke,His wife sued for divorce and asked for custody of the,cash,cat,His wife sued for divorce and asked for custody of the cash.,3,1.350174903869629,208.00037503242493
FED_20161227a_3T2,2,18,1,nonjoke,"When we watch a sexy movie, my wife leans over and breathes on my",glasses,collar,"When we watch a sexy movie, my wife leans over and breathes on my collar.",4,0.6000900268554688,220.00184106826782
FED_20161227a_3T2,2,147,1,joke,"When we got divorced, my wife and I split the house; she got the",inside,kitchen,"When we got divorced, my wife and I split the house; she got the inside.",4,0.6333858966827393,228.00277614593506
FED_20161227a_3T2,2,103,1,joke,"I still miss my ex-wife, but I am improving my",aim,ego,"I still miss my ex-wife, but I am improving my aim.",,,240.00412893295288
FED_20161227a_3T2,2,96,1,nonjoke,"When the kid came into the store and asked for empty boxes, the owner gave him the",register,crate,"When the kid came into the store and asked for empty boxes, the owner gave him the crate.",2,2.1836130619049072,250.0053210258484
FED_20161227a_3T2,2,144,1,nonjoke,The difference between a dog and fox is about five,beers,degrees,The difference between a dog and fox is about five degrees.,1,1.6501789093017578,264.00701904296875
FED_20161227a_3T2,2,20,1,nonjoke,"He told me he just bought a set of balloon tires, and I told him I didn't even know he owned a",balloon,truck,"He told me he just bought a set of balloon tires, and I told him I didn't even know he owned a truck.",,,274.00818610191345
FED_20161227a_3T2,2,86,1,nonjoke,"I asked the florist what I should give to my girlfriend, and he suggested his",address,tulips,"I asked the florist what I should give to my girlfriend, and he suggested his tulips.",2,0.4667551517486572,282.0091209411621
FED_20161227a_3T2,2,78,1,nonjoke,My brother-in-law enjoys fixing things around the house so much he spent an hour last night just fixing our,drinks,stove,My brother-in-law enjoys fixing things around the house so much he spent an hour last night just fixing our stove.,1,1.2501599788665771,312.01285314559937
FED_20161227a_3T2,2,44,1,nonjoke,The only place where you can find people who spend all their time minding their own business is the ,cemetery,bank,The only place where you can find people who spend all their time minding their own business is the bank.,2,1.8502271175384521,320.0139060020447
FED_20161227a_3T2,2,39,1,joke,The best way to remove coffee stains from a white blouse is with,scissors,detergent,The best way to remove coffee stains from a white blouse is with scissors.,2,1.6835651397705078,328.0149259567261
FED_20161227a_3T2,2,110,1,nonjoke,It's not hard to meet expenses; they're ,everywhere,affordable,It's not hard to meet expenses; they're affordable.,3,1.3167428970336914,338.0162010192871
FED_20161227a_3T2,2,88,1,nonjoke,The wind was so strong it blew out three,fuses,streetlights,The wind was so strong it blew out three streetlights.,2,1.2668139934539795,356.0018000602722
FED_20161227a_3T2,2,35,1,joke,"Now that the Hollywood couple has ironed out the divorce settlement, they can finally go ahead with their",nuptials,careers,"Now that the Hollywood couple has ironed out the divorce settlement, they can finally go ahead with their nuptials.",,,370.0035979747772
FED_20161227a_3T2,2,150,1,nonjoke,One way to keep pornography away from teenagers is to put it in a,textbook,cabinet,One way to keep pornography away from teenagers is to put it in a cabinet.,3,0.7334189414978027,378.00460410118103
FED_20161227a_3T2,2,122,1,nonjoke,"If you're filthy rich, sending your kids to college is a wonderful", cleaner,luxury,"If you're filthy rich, sending your kids to college is a wonderful luxury.",3,1.9335827827453613,392.00634813308716
FED_20161227a_3T2,2,15,1,joke,"When John bought a bulldog, it was no time at all before he had that dog eating out of his",leg,fingers,"When John bought a bulldog, it was no time at all before he had that dog eating out of his leg.",,,404.0078661441803
FED_20161227a_3T2,2,50,1,nonjoke,The only time my father ever raised a hand to his children was in ,self- defense,discipline,The only time my father ever raised a hand to his children was in discipline.,2,2.767037868499756,416.0093970298767
FED_20161227a_3T2,2,61,1,joke,"For great vacation, put the kids in the back seat, and take a ",cruise,freeway,"For great vacation, put the kids in the back seat, and take a cruise.",3,1.600167989730835,428.0109579563141
FED_20161227a_3T2,2,14,1,nonjoke,He got a medal for bravery on the beach when he rescued a girl from a ,lifeguard,shipwreck,He got a medal for bravery on the beach when he rescued a girl from a shipwreck.,1,1.6334540843963623,440.01241302490234
FED_20161227a_3T2,2,149,1,joke,"She asked what state he was born in, and he said in the ",nude,East,"She asked what state he was born in, and he said in the nude.",4,0.9334821701049805,448.0133249759674
FED_20161227a_3T2,2,129,1,joke,The perfect companion to a vegetarian dinner is a ,steak,salad,The perfect companion to a vegetarian dinner is a steak.,3,1.5502269268035889,456.0143721103668
FED_20161227a_3T2,2,139,1,joke,They redecorated the bar with new,drunks,wood,They redecorated the bar with new drunks.,3,1.2835149765014648,466.0156171321869
FED_20161227a_3T2,2,140,1,nonjoke,You can keep your kids in hot water with ,dishes,rules,You can keep your kids in hot water with rules.,2,1.8002550601959229,474.01661705970764
FED_20161227a_3T2,2,27,1,joke,"Once a week they hold a bingo game, and all the proceeds go to fight",gambling,disease,"Once a week they hold a bingo game, and all the proceeds go to fight gambling.",,,484.00122594833374
FED_20161227a_3T2,2,107,1,joke,The difference between a good speaker and a bad one is often a nice,nap,diction,The difference between a good speaker and a bad one is often a nice nap.,3,1.1001300811767578,514.004940032959
FED_20161227a_3T2,2,127,1,joke,The penalty for dishonesty is the disgrace of dying,rich,unloved,The penalty for dishonesty is the disgrace of dying rich.,,,522.0059180259705
FED_20161227a_3T2,2,145,1,joke,The only person who sticks closer to you in adversity than a friend is a,creditor,spouse,The only person who sticks closer to you in adversity than a friend is a creditor.,4,0.766718864440918,532.0072231292725
FED_20161227a_3T2,2,37,1,joke,"The cops claimed that the prisoner just decided to come clean, but most people think he was forced into the",bathtub,admission,"The cops claimed that the prisoner just decided to come clean, but most people think he was forced into the bathtub.",,,540.0081861019135
FED_20161227a_3T2,2,73,1,joke,One thing that makes the world go round is,detours,greed,One thing that makes the world go round is detours.,2,1.600187063217163,550.0093920230865
FED_20161227a_3T2,2,111,1,joke,"Some husbands are good providers, but only if you count",children,salary,"Some husbands are good providers, but only if you count children.",3,1.3002991676330566,568.0115239620209
